{
  "benchmark name": "CLEVER",
  "program name": "LoopSub.main",
  "method name": "foo",
  "LOC":8,
  "# Loops":1,
  "# non-linear arithmetics":0,
  "changes": 
  [
    {
      "change line": 4,
      "change type": "Update", 
      "change operation": "Arithmetic" 
    },
    {
      "change line": 5,
      "change type": "Update", 
      "change operation": "Comparison operand" 
    },
    {
      "change line": 5,
      "change type": "Update", 
      "change operation": "Arithmetic" 
    }
  ],
  "counter-example":
  [
      {"int x":5}
  ]
}