{
  "benchmark name": "caldat",
  "program name": "badluk",
  "method name": "snippet",
  "LOC":49,
  "# Loops":3,
  "# non-linear arithmetics":4,
  "changes": 
  [
    {
      "change line": 20,
      "change type": "Update", 
      "change operation": "Comparison operator" 
    },
    {
      "change line": 29,
      "change type": "Update", 
      "change operation": "Comparison"  
    },
    {
      "change line": 35,
      "change type": "Update", 
      "change operation": "Comparison operator" 
    }
  ],
  "counter-example":
  [
      {"int IYBEG":10}
  ]
}