{
  "benchmark name": "caldat",
  "program name": "julday",
  "method name": "snippet",
  "LOC":24,
  "# Loops":0,
  "# non-linear arithmetics":10,
  "changes": 
  [
    {
      "change line": 10,
      "change type": "Insert", 
      "change operation": "Arithmetic" 
    },
    {
      "change line": 25,
      "change type": "Update", 
      "change operation": "Arithmetic" 
    }
  ],
  "counter-example":
  [
      {"double mmj":10.0},
      {"double idj":10.0},
      {"double iyyyj":0.0}
  ]
}