{
  "benchmark name": "CLEVER",
  "program name": "UnchLoop.main",
  "method name": "foo",
  "LOC":9,
  "# Loops":1,
  "# non-linear arithmetics":0,
  "changes": 
  [
    {
      "change line": 4,
      "change type": "Update", 
      "change operation": "Initial value"
    },
    {
      "change line": 8,
      "change type": "Update", 
      "change operation": "Return statement" 
    },
    {
      "change line": 11,
      "change type": "Update", 
      "change operation": "Calling parameter"
    }
  ],
  "counter-example":
  [
      {"int x":5}
  ]
}