{
  "benchmark name": "bess",
  "program name": "bessj1",
  "method name": "snippet",
  "LOC":26,
  "# Loops":0,
  "# non-linear arithmetics":25,
  "changes": 
  [
    {
      "change line": 20,
      "change type": "Delete", 
      "change operation": "Arithmetic"
    },
    {
      "change line": 25,
      "change type": "Insert",
      "change operation": "Logical clause" 
    }
  ],
  "counter-example":
  [
      {"double x":11.0}
  ]
}